id,Text,Label_Id,Label,Label_Rev
679,"How many LGBT teenagers will now live long, healthy, happy lives thanks to Doritos' brave stance in making rainbow chips?",3,Neutral,2
2357,Somebody ask Morehouse &amp; Spelman about non-binary trans folk yet?,3,Neutral,2
1105,"I've been rewriting R01 grant and watching ""Will &amp; Grace"" all day. My sad, ghey science life.",3,Neutral,2
3341,"i get hives every time i see someone say a person isnt really queer bc they are in a ""hetero"" relationship",2,Positive,1
4538,and I'M my favorite bisexual hoo ah,2,Positive,1
5477,"""Do you know Courtney Zelter? I heard she was bisexual."" ""I thought she was Canadian?"" - huhhhhh",3,Neutral,2
5157,oh man i feel sick thats so fucked up even if he was trans due to trauma you dont get to misgender him!!!!!,2,Positive,1
985,"Fall will be fun: Intro to Trans Studies and Honors Business Ethics. A brand new course, and another that I've taught a bunch :)",2,Positive,1
314,"""It hurts when black people don't rally behind LGBT people.""
- ",3,Neutral,2
2188,"To those who said I am not allowed to play, watch, know or be involved because i dont count as a proper male as im bisexual

Go fuck yourselves 

Regards",3,Neutral,2
2587,"I completely understand now why knocking up a cis dude is inherently trans male/nonbinary erasure, just as bp is trans erasure too.",3,Neutral,2
4872,"""All things to all men."" Yes/No gay marriage.Yes/No climate change. I was born rich/poor.""Whatever you like that's me!""Turnbull #auspol",3,Neutral,2
4048,Y'all know that transgender cunt? Yeah she's a cunt,4,Negative,3
1478,I want  to go on #BB11 &amp; insult the hell out of that Psycho Shinde &amp; her asslicker biased chamcha Salman! High time now!,4,Negative,3
658,"All children have a right to bodily integrity whether they are born male, intersex or female. #i2 #EndMGM #EndIGM #EndFGM",1,Very_Positive,0
468,I will say this again . Lots just hate Burnaboy cos he’s not an asslicker. You leave government wey dey chop you and your generation birthright . You dey bash Burna cos he said the truth. Nigerians truly deserve the leaders we have.,3,Neutral,2
1525,"Bitch you can't say you bisexual if you 13 , get some real dick before you make that decision :weary face::raised hand:",4,Negative,3
432,"trans boy grantaire can wear makeup fukc y ou ,",3,Neutral,2
5725,"Having Kay blocked is kinda funny cuz when someone quote-tweets him you can imagine he's saying, ""I'm boring &amp; dumb &amp; hate the poors"" or ""I'm boring &amp; dumb &amp; hate trans people"" or ""I'm boring &amp; dumb &amp; hate BIPOC"" and almost always be exactly right. 10/10 Would recommend.",3,Neutral,2
794,"I love my trans, non-binary and intersex brothers, sisters and siblings and I am sorry for the bigotry you’ve experienced this week and always. You don’t need celebrities to validate you. :growing heart:",1,Very_Positive,0
278,Gods cursed gamer Dax and want his musical power.He must leave his friends captured by demons or lose his sanity #A #F #LGBT M/M #Own #PreDV,3,Neutral,2
5215,I have major feels for this guy but he thinks I'm a lesbian iM SAD,3,Neutral,2
3190,I'm considering wearing Asexual colors to Pride,2,Positive,1
1059,"ever been asexual on tinder?

it's fuckin hilarious, I do not recommend.",3,Neutral,2
2174,instead of mpreg have you ever considered trans people like wow. holy shit,3,Neutral,2
1068,some couples watch tv series together :face with rolling eyes::man gesturing NO: but me and  are brainy :nerd face: we READ book series together :smirking face::books: right now are about to start captain underpants:smiling face with smiling eyes: k gtg tra la laa byee,3,Neutral,2
3657,Excited for the Addressing the LGBT Youth Homelessness Crisis session this morning!! #LGBTLeaders,2,Positive,1
5588,Is it too early to go on another rant about this fake bisexual/lesbian trend with girls? Nvm no such thing. Lemme get this crackin.,3,Neutral,2
2784,Listening to a delightfully funny and frank discussion on being intersex #IENicosia2016,2,Positive,1
4491,"brother: isn't halsey sexual

me: uh what?

brother: she's sexual she likes boys and girls

me: :woman facepalming: it's called bisexual",2,Positive,1
2793,"I literally cannot stand Caitlyn Jenner, for a trans woman she is so ignorant",4,Negative,3
5220,"today my mom called me being gay my ""situation.""",3,Neutral,2
210,i am an asexual lesbian bewitched by a hairy white boy w/ a receding hairline,3,Neutral,2
3587,"Super proud of launching this label to assist gender-variant, nonbinary, trans artists, storytellers, musicians etc. XYYX Records. LET'S GO!!
.
.
#transmucian #transgender #gendervariant #nonbinary #intersex #LGBTQIA #ftm #mtf #agender #cisgender",2,Positive,1
3473,"To Westboro baptist, God loves all his children, gay or straight. He tells us to ""love thou neighbor"". Show compassion and love, not hate. :revolving hearts:",2,Positive,1
4227,"We stand by lesbian, gay, bisexual, trans, queer families. Always and forever, we stand by all families.",1,Very_Positive,0
4939,I'm actually a lesbian. Surprise.,2,Positive,1
5258,If Andrew ever seh first man fi lef the house a battyman Jamaica wouldnt have another case of COVID,4,Negative,3
5623,"dare anyone, male female straight gay bi queer questioning or alien multidemensional asexual being 2 not b turned on by Adam Fucking Lambert",3,Neutral,2
3918,"I decided that to be the opposite of a TERF, I'm aiming to be a
Trans
Welcoming
Inclusive
Radical
Queer",2,Positive,1
4650,"My kids can be gay, straight, bisexual, anything! Idc! But let them mfs come to be saying “I wANt tO bE a PoLiCE oFFiCEr”",2,Positive,1
4098,"Too trans to live, Too gay to die",4,Negative,3
5803,If you think intersex people aren’t lgbt you can fuck right off,2,Positive,1
5327,"Semi-regular reminder:

Trans women are women
Trans men are men
Non-binary people are people who can use whichever pronoun or ID they feel suits best
Ditto for Trans+, NB+, and Intersex people

Respect pronouns &amp; identity. Please &amp; thank you.",2,Positive,1
5054,"""people who ship nick with anyone? do you realize this is an ACE attorney?""
does this mean ryuunosuke is a great asexual?",3,Neutral,2
261,let's just reflect on the fact that my mom just asked me if I was a lesbian and was being completely serious about it,2,Positive,1
4351,":women holding hands: lesbian  iMessage group chat :eyes::smirking face: 
#TeamLesbian:women holding hands:
#TeamStud :necktie:
#TeamFem :dress: 

Like or RETWEET",2,Positive,1
3956,My mom just said “gays are that way because their mothers make them afraid of women” and I’m fighting the urge to come out just to spite her,2,Positive,1
1492,I find it funny I'm literally ok with Gav calling me butt pirate but if anyone calls me buddy I'm annoyed af :man shrugging::rolling on the floor laughing:,3,Neutral,2
4654,Ugly bitches love calling lesbians scared for not fucking with them,2,Positive,1
5941,joan is such a lezzie wtf i hate roger :pouting face::face with symbols on mouth:,4,Negative,3
2959,"#EuropeanParliament resolution on rights of #intersex people and the UN, recommend depathologization. How does the new Danish National Guidelines on Disorders of Sex Development, referenced during #CESCR66 when answering on intersex, live up to this? #dkpol  ",2,Positive,1
1308,"A guy on halo just called me a ""Dick sucking queer fart"" that guy...is now my best friend",4,Negative,3
3435,DAWG can a beautiful bi/lesbian brown skin let me love them pls wtf,2,Positive,1
3892,"Spent the last day of 2015 transcribing a 6,000-word interview about a lesbian werewolf comic and honestly that sums up my year pretty well.",3,Neutral,2
1039,"Me, semi jokingly: haha...hnk is a trans only event

Some cis idiot trying to be funny: guess ill throw away all my merch and die xD

Me, completely serious now: yeah you do that.",3,Neutral,2
3677,New year new me. Jk that's gay as hell. im gonna continue being a badass :smiling face with sunglasses::face with tears of joy:,4,Negative,3
4407,"Ok but like double edge sword typa shit, when I tell a girl that I like guys too I’ve had girls say shit like “you’re not a gold star lesbian” and “eww you’ve had a dick in you?” Like bitch chill... it’s not a big deal",2,Positive,1
6108,"to count one's beads = rezar el rosario

tə kaʊnt wʌnz biːdz

There were a few old women counting their beads in the hushed silence of the chapel.",3,Neutral,2
6104,Can heteros chill the fuck out with the name LGBT? I’ve heard way too many people go “um isn’t it lgbtqashgdhdhs+++ :))” like fuck you not a single queer cares if you only say LGBT,2,Positive,1
1210,I'm at the gay pride after party and things have escalated quickly ,2,Positive,1
5471,"There's a woman that greeted us with ""hello beautiful people""
Leh ana manne heik metfe2el w mabsout bi 7ayete",3,Neutral,2
3289,"So typical that the only downside to an excellent  all-female event on queer and feminism is rowdy, disruptive men outside.",2,Positive,1
2003,i'm gay for Cole from Mystery of Stonecrack Town,3,Neutral,2
249,hey  what the fuck is up with removing all the bisexual tweets? you can remove pride but not racists? fuck you and and your staff.,2,Positive,1
5048,what's good :winking face with tongue: u candy cane cum guzzler :tongue::Christmas tree:DICKCEMBER is here and u know what that means :snowflake: HOE HOE HOE season has arrived :Santa Claus: medium-light skin tone: put on y...,3,Neutral,2
602,Asexual-curious: I've often considered not fucking everything.,3,Neutral,2
1965,"Half bae, she half straight and half gay.",3,Neutral,2
3180,"George Lopez and his anti- black, LGBT- phobic, misogynist ass is fucking CANCELLED!",2,Positive,1
2186,"FYI: Non-Binary as a gender designation is a spectrum. 

Non-Binary can be agender, bi-gender, genderqueer, intersex or any designation that is not binary male or female.

This can include non-binary genders that are tied to ethnic indentity.",2,Positive,1
3166,"Cw: omegas with vaginas, intersex male omegas uhh yeah 

Any kind of humping, frotting, whatever is so fucking hot &amp; cute. Deku being desperate &amp; needy to get off, begging Kacchan to fuck him. But Kacchan thinks he’s being too greedy, didn’t even think about his alpha first.",3,Neutral,2
3390,queer/trans culture is growing up dealing w/ cishets not liking you bc ur visibility made them uncomfortable so they’d make up lies/rumors or just talk shit behind ur back since they were too scared to say how they really felt to your face:sad but relieved face::crying face:,2,Positive,1
6018,Sent crush Birthday text if he leaves me on read I’m officially asexual,4,Negative,3
1052,btw hijikata is gay and trans and autistic,3,Neutral,2
3123,"As for the whole asexual/sexual bit, it's called talking and compromise and working it out like a fucking adult",4,Negative,3
4521,Fucking hate the gays,5,Very_Negative,4
3143,"Any girl/shemale/trans/femboy wanna trade nudes ? 18+ only
#cockrate #dickrate #hard #cock #horny #nudes #dm #cocktribute #cock #slut #horny #porn #tits #cumtribute #nsfw #dmme #gay #bisexual #milf #cocks #cockrate #dick #cockrates #bbc #bbw #slut #cumslut #nudes #thicc #cuckold",3,Neutral,2
4836,theres only two genders! no i don't study genetics. no i don't know what intersex means.,5,Very_Negative,4
5016,Oh and I was just enjoying that ‘nice’ couple on #firstdates until the ‘tranny’ comments. :pouting face:,3,Neutral,2
2187,why these dumb ass kids makin pop music dancin in front of a pool of blood ol backward ass satanist ass weirdo lame simp ass queer,4,Negative,3
11,His punk ass could never scare me im from poverty dummy u mad cause u bisexual,4,Negative,3
4121,gentle reminder as stories of uterine transplants make the rounds: your joking offers to donate the uterus you don't want are not appreciated. many intersex + trans people are genuinely mourning not being able to birth a child. please don't say it if you don't mean it.,3,Neutral,2
2323,"If growing up in rough circumstances and with access to shitty services is the excuse for this man growing up being a violent abuser…more black women and black LGBT would be out here killing and abusing people

stop making excuses",3,Neutral,2
2270,y’all b having the craziest display names :loudly crying face: i’ll just be scrolling and see smth rted by “cum guzzler supreme”.  um WHO,4,Negative,3
3552,The way that our society has treated intersex children and people makes me fucking sick,3,Neutral,2
2061,"""Lauren Jauregui is so hot"" ""FUCKING LESBIAN EW GO AWAY"" well",4,Negative,3
5838,the real question is why do cis people focus so hard on trans people having surgery and make transition sound like some kind of twelve-step program where you graduate into You Look Like The Real Deal at the end,2,Positive,1
6084,Intersex Individuals Are Clever :rose:,3,Neutral,2
1859,two girls found out i was bi and tried to talk to me about how they think gay people shouldnt be in children's media and im like how the Fuck did you find out i was bi???,3,Neutral,2
2305,Tanya just called someone a cum guzzler and idk if I’ve ever been so proud of her,4,Negative,3
3297,I wish that Trans Day of Shit Fuck Damn was called Trans Day of Shit Damn Motherfucker instead so that we could use D'Angelo as our pride anthem,3,Neutral,2
1368,MY BISEXUAL CUT IS BACK BITCHES,3,Neutral,2
771,"'Emily didn't cry at the party, she just ran around in her multi coloured cape telling people she was bisexual'",2,Positive,1
2062,People are unnaturally freaked out over bathrooms as far as Colorado because of senseless #HB2 #LGBTQ discriminatory legislation. #NCpol,2,Positive,1
3022,"...anyway bi and pan are distinct things by their own definitions

like i cant say im pan bc i dont think my attraction is fully without regard for gender, but i also work my definition of (my) bisexuality being attracted women and nb ppl regardless of presentation",2,Positive,1
6199,MERRY QUEER NEW YEAR FROM ITALYYYYYYYYY -Mary,2,Positive,1
728,Unfollow me if you think asexual or people under the asexual umbrella are not lgbtqiA+ xx,1,Very_Positive,0
1963,Target has the best selection of asexual weirdos.,3,Neutral,2
6073,"""Captain America, Marvel's preeminent vintage bisexual, was quoted as saying –""",4,Negative,3
514,special announcement:  is no longer asexual. she's engaged-wedding date coming soon,3,Neutral,2
1816,IMAGINE BEING QUEER AND FAT WITH SEVERE ADHD AND NO IMMEDIATE FAMILY,3,Neutral,2
239,just remembered walking through soho last night past some roadmen and they went ‘there’s batty boys everywhere’ like YES well done you’re in fucking soho. indoor venues need to open asap so the gays can reclaim soho in full :face with steam from nose:,3,Neutral,2
2797,"Overheard in the QX office: ""It should be LGBTQIVB - Lesbian, Gay, Bisexual, Transgender, Queer, Intersex, Victoria Beckham.""",3,Neutral,2
1548,just because you have a girlfriend doesn't mean you're  a lesbian :upside-down face:,3,Neutral,2
3445,"Dong Squad: The adventures of two pansexuals, an asexual, and a straight.",2,Positive,1
5500,"Losing followers for Transition Posting is so like.... Wild. Trans is the first word in my bio, coward!",2,Positive,1
3267,"how do i go and watch ‘love, simon’ without exposing my bisexual ass",2,Positive,1
886,Hoste just said it's not gay to fuck a guy in the ass but it's gay to get fucked in the ass...,4,Negative,3
3954,"can people fuckin like chill with the gay fetishes? 
some of you teenagers/pre-teens are so fucking creepy.
y'all actually are delusional as FUCK.

y'all all about gay ships but when real LGBTQ+ problems come to eyes, y'all wanna stay hushed. Fuck outta here.",3,Neutral,2
912,If I was to get denied admission because I was gay. I'd sue so fucking for hard and ban that school from this country w dat $$:man shrugging: medium-light skin tone:,3,Neutral,2
5279,I can’t stand when parents post pictures of their kids doing things contrary to gender roles being like “NORMALIZE boys painting their nails!” Why does this have to be a post I see lol.. as though I’m walking around calling 5 year olds “gaylord” or something,4,Negative,3
3815,MESSAGE TO HATERS: u gay,5,Very_Negative,4
5837,Can we like STOP putting bisexual and pansexual right next to each other like they're the same fucking thing cause they're fucking NOT?,3,Neutral,2
3375,so are they changing the plot of heathers or are they having the white cis leads gleefully murder the poc/ trans characters?,3,Neutral,2
17,"Look, I get that rainbow flag capitalism sucks but you can still take care of a family of 4-6 on a single income in the US. And while you have to give things up, those things are fake and ghey and you secretly hate them anyway",3,Neutral,2
2758,bandersnatch is an indecisive bisexual's worst nightmare,3,Neutral,2
4601,oh shit there's an intersex character on faking it :-0!!!,3,Neutral,2
6188,IT LITERALLY JUST OCCURRED TO ME THAT DOOM IS INTERSEX,3,Neutral,2
4369,Lgbtq warrior right here look at him #Montenegro #Eurovision,3,Neutral,2
527,I just thirst followed so many trans boys,3,Neutral,2
320,"All children have a right to bodily integrity whether they are born female, intersex or male. #i2 #EndFGM #EndIGM #EndMGM",2,Positive,1
5630,crazy how y'all are gay,3,Neutral,2
1242,#FF Awesome resources and peeps!                  ,3,Neutral,2
5164,being able to reclaim a slur is not proof of oppression lmao idk why y’all think people saying “only lesbians can say dyke” means people are saying biphobia doesn’t exist,3,Neutral,2
1370,Taling a quick break from my ARTS to relax so I dont gey overwhelmed I really miss coffee....,3,Neutral,2
3361,Asexual people are so lucky.,3,Neutral,2
312,School discipline disproportionately impacts Queer and students of color   #KnowHerTruths #trustblackwomen,2,Positive,1
4618,Love pre drinks at Jacobs.. It's just full of GAY anthems!! :person tipping hand: medium-light skin tone::person tipping hand: medium-light skin tone:,1,Very_Positive,0
2916,"I'm ""Asexual"" and I don't know what it means.",3,Neutral,2
2033,To all my #bisexual brothers and sisters as we have ended our #BiWeek and to all our fellow LGBTQ+ allies. I want to say thanks you for the support! You help to make #BiVisibility known and we appreciate you so much! #bipride :sparkling heart::purple heart::blue heart::red heart::red heart::red heart:,1,Very_Positive,0
1882,My favourite thing about the news that Casimir Pulaski was intersex is that on the NYT FB page link for it there's a whole thread of Sufjan lyrics,3,Neutral,2
2725,I just remember watching the longest yard as a kid and being obsessed with the group of crazy gay people :face with tears of joy:,3,Neutral,2
5200,Trans People Are Hella Rad :glowing star:,1,Very_Positive,0
5734,I'm sick of cowards and bigots in sports refusing to embrace and support LGBTQ fans and players.,2,Positive,1
71,I literally should just go lesbian. Boys suck.,3,Neutral,2
1854,What is up with transphobic intersex people?,3,Neutral,2
6185,To the high school kid walking in the middle of the street staring me down and smoking your e cig my baby sister could kick your ass queer,5,Very_Negative,4
6203,why do ppl insist im a lesbian wtf im not a lesbian u should know by how much i talk about dick n boys,3,Neutral,2
3983,Today my cat straight up murdered a mouse to protect our home and I am SHOOK.  #blessed #ewthatwasgross #butalsoproud,3,Neutral,2
3303,"When girls put pictures up , and the caption is some queer ass quote . I personally cannot find a f'ck to give .",4,Negative,3
533,"For an affirmed asexual, I sure do call a lot of characters ""fuckable.""",3,Neutral,2
3127,LGBT? You mean liquor guns bacon and tits,5,Very_Negative,4
5513,RT if you like gay/bisexual/lesbian/transsexual/pansexual/(other sexualities) PEOPLE! &lt;3,2,Positive,1
565,my sister's citizenship teacher told her class he thought trans kids should be shot today and let me tell u i am going to KICK OFF,3,Neutral,2
1058,Intersex is so interesting. People have a responsibility to become more aware of this condition. It’s so much more common than you would think,2,Positive,1
4268,Asexual non-binary folks are real. There's nothing wrong with us.,2,Positive,1
2398,(baekhyun voice) what do you call a queer witch? A BIHEXUAL,3,Neutral,2
1194,"Roses are red
Pumpkins are spiced
I am a gaylord
And so is Christ",3,Neutral,2
571,In the process of adding interview 153 and 154 to the #Asexual #Artists  queue. Over 150 artists interviewed (and counting),2,Positive,1
5938,LGBTTTQQIAA 는 Lesbian Gay Bisexual Transgender Transsexual Two-spirited Queer Questioning Intersex Asexual Ally 의 약자입니다.,2,Positive,1
5672,Why are most lesbians so damn fake bruh!,3,Neutral,2
1870,Can't wait to get married to all of my queer pals!!!!!!,2,Positive,1
2385,"No Country for Black, Hispanic, Gay, Transgender, or Muslim Women #SeanSpicerAFilm ",5,Very_Negative,4
1462,Disney are some scared bitches when it comes to lgbt rep.... a large majority of their patrons/audiences are either homophobic or racist or both. I’m not trusting anything until I SEE it.,3,Neutral,2
118,hi everyone i’ve typed this out so many times but i’m finally ready to say this i’m bisexual i was so scared to tell anyone because i was scared of people abandoning me but it’s finally time i tell people who i really am i hope you all still see me the same :yellow heart:,2,Positive,1
2804,ppl aren't inherently lgbt for being intersex or polyamorous and if that makes you upset idk what the fuck to tell u,3,Neutral,2
5050,"So proud to watch my transgender friend &amp; activist Sarah McBride speak at the #DNCinPHL &amp; make history. Articulate, smart &amp; beautiful! ",1,Very_Positive,0
6168,"If you think Dom Kennedy suck you automatically bi sexual, and a man can't be bisexual so you automatically a faggot",5,Very_Negative,4
1736,"all of this aside though, if you headcanon a canon gay character as anything other than GAY you're trash. being gay is wonderful and valid and nothing about it needs to be fixed or changed.",2,Positive,1
5555,"we're we, here fuck, we're shit, queer up",2,Positive,1
4100,"Alison DiLaurentis, a known bisexual.",2,Positive,1
3543,"Bisexual culture is watching Love, Simon cast interviews and trying to stare at everyone at the same time because they’re all such attractive, beautiful, wonderful human beings",2,Positive,1
4382,So 6ix9ine was trying to link up with Lil Nas X for what tho.. knew that rainbow head MUTHAFUCKA was a butt pirate,4,Negative,3
2543,In February the Department of Corrections marched in our Pride. On Wednesday they locked a trans women in a cell overnight w her rapist,3,Neutral,2
1835,how are we gonna have a cisgender woman playing a transgender man when we literally have all these hot ass trans men actors out here waiting to take a fucking role cuz they don’t get casted for shit but then act all inclusive,2,Positive,1
2954,im refusing to work monday and im saying that now so i cant cave later. ive been SO busy every day i still havent come down from my finals stress and i NEED to doodle gay shit and listen to critrole for eight hours straight or ill die,2,Positive,1
1321,all I do on this website is call my mutuals nerds or gay,3,Neutral,2
3018,Reminder: queer women in relationships with men are still in queer relationships. My relationships aren't straight because I'M not straight,2,Positive,1
5397,"lgbt- lesbian gay bi trans

lgbtqia- lesbian gay bi trans queer intersex asexual 

lgbtqiahsmtmts- lesbian gay bisexual trans queer intersex asexual high school the musical the musical the series",3,Neutral,2
3351,"""This intersex bullshit is just Satan doing evil."" —The Comments Section:gem stone:",4,Negative,3
1728,I suck transsexual dick for a living,3,Neutral,2
1434,"My whole family is now trying to decide how using queer is any different than ""fag"", the n-word, and a variety of other racial slurs.",3,Neutral,2
1766,I stg Jonathan from queer eye is turning into a fucking cryptid,3,Neutral,2
852,"I'm not gonna RT that dumb lady who wrote the magic books. 

But just know, I support and affirm trans* people, and always will.

I have many among my friends, and in my heart. 

*And non-binary, and gender non-conforming and intersex, et al",3,Neutral,2
1460,Special skills include: telling if someone is gay solely based on that tiny thumbnail that comes up in Gmail.,2,Positive,1
2462,Notty Flow??!! The lesbian chick? Why am I streaming this.. Nani ako na link Ya Dj Afro?? #NairobiDiaries,3,Neutral,2
3114,Nothing scares you more than when your tranny starts slipping in your truck :loudly crying face:,4,Negative,3
379,"Whelp, all my bisexual honey nut feelios were sated in watching #ASimpleFavor :cocktail glass: Like damn.",3,Neutral,2
2071,Nothing makes me more sad than the lady who has to sit outside stop and shop ringing a bell for $$ for the gay hating salvation army,3,Neutral,2
5905,Can I just say that straight girls who love the Sassy Gay Friend but are Ew Don't Look At me to l/b/p girls are NOT my allies.,2,Positive,1
2570,"Cheers if you have or want to come out as gay, bi, trans or even a crazy cat lady! #Love &amp; #acceptance 4 all! #NationalComingOutDay! Be You!",2,Positive,1
5117,Turns out the lass I thought was fit on bear grylls the island is actually fucking transgender. What a bombshell! Fucking hell :face with tears of joy::face with tears of joy:,3,Neutral,2
1294,"""Finding Dory: Film Rumored to Be 1st in Disney Pixar's History to Feature Lesbian Couple"" because frozen wasn't disney/pixar :people with bunny ears:",3,Neutral,2
4451,We need bisexual Raven in our lives :person bowing::person bowing:,2,Positive,1
2664,honestly? baritone sax is such a lesbian instrument,4,Negative,3
