id,Text,Label_Id,Label,Label_Rev
2040,/ I forgot to intro but all u need to know is that he's the most bisexual person ever so everyone should hit him up bc he loves sex so much,3,Neutral,2
1782,"Heterosexual- Fuck You.

Homosexual- Fuck This.

Bisexual- Fuck You AND You.

Pansexual- Fuck Everything.

Asexual- Fuck No.",2,Positive,1
5585,"A friend asking me what my type was and then saying wait what are you btw? And I just replied saying oh I’m bisexual 

And SHE REPLIED SAYING YES ME TOO 

this is great",3,Neutral,2
3367,Just went to an awesome LGBT session at #AMLE2014 We owe it to our students to break the silence!,1,Very_Positive,0
4794,"at this point this college drama is pissing me off and i got other issues to deal with- i'm off to cry at the fact i'm not on the GIC waiting list because of p****** + other humans.

hope you all have a nice night, i hate being trans and i want death.",3,Neutral,2
4202,"LGBTQIAPD stands for Lesbian, Gay, Bisexual, Transgender, Questioning or Queer, Intersex, Asexual, Pansexual and Demisexual. I support all.",1,Very_Positive,0
800,Watching Gay &amp; Lesbian Movies On Netflix,2,Positive,1
5632,Is it just me or does that new show Chozen about the fat gay white rapper look like it fucking sucks #ShowSucks,4,Negative,3
1074,"Bryn and I were talking about Ted talks, completely hetero convo, when a women yells ""get out of my face, dyke bitches. fucking lesbians""",3,Neutral,2
1266,white men have my ghey brothers in a HOLD. ima pray for yall:purple heart:,3,Neutral,2
2992,I’m just a sweet transvestite from transexual transylvania,4,Negative,3
3139,"C'mon. I know you're really extra lesbian. Your beanie, thick framed glasses, squared flat butt, flannel and muddy sneakers scream queer.",4,Negative,3
3949,Declaring myself asexual. Fuck y’all,3,Neutral,2
1083,they/them dyke girlboyfriend can now officially be my gender thank you :-),3,Neutral,2
716,"Doctor: ""You should stay away from trans fats""
What should I eat, cis fats? lol
Dr: ""Here's a prescription to shut the fuck up forever""",3,Neutral,2
5059,There are limited transgender friendly healthcare services in Jamaica #UpWidAdvocacy,2,Positive,1
2754,Headcannon that kay faraday is asexual. Shes too busy stealing the truth to steal virginities,3,Neutral,2
2358,"i'm here, i'm queer, &amp; i'm ready to binge watch yuri!!! on ice",2,Positive,1
308,"Wait, your Fantasy Fooball characters can’t be flagrantly gay tieflings? Huh... Sounds lame. #DnD",3,Neutral,2
759,"I want a Bruce in the streets and a Caitlyn in the sheets
.
.
.
Basically, I want a transexual.",3,Neutral,2
671,i'm not gay but i want calvin harris to choke me,3,Neutral,2
1451,"hip hip hooray for judgmental people who don't judge the gays, just the people who don't support them. you are so great.",2,Positive,1
5334,"is ""shobitch"" japanese for ""the horny asexual""",3,Neutral,2
5724,"the person in front of us is driving slow and my mom goes ""what is this butt fucker doing?"" :face with tears of joy:",4,Negative,3
5076,"Do not pay anyone less than what you’d pay a cisgender heterosexual white male to do the same task.  This includes children, immigrants and women. This especially when any of the aforementioned categories are trans, queer, class poor, a religion other than yours, disabled or fat",1,Very_Positive,0
589,“Peter Pan is bisexual as fuck” #quotesbynick,2,Positive,1
3449,"•Introducing Elizabeth!
•OC
•Switch (Will explain how this will work)
• Bisexual
•Semi-open DMs (I'll explain in a sub-tweet)
•Elf Sorceress
•~Your  sexual essence will power my tome~
•More detail description in sub-tweet
•Retweet and Like to have your libido judged.",3,Neutral,2
905,Remember when Griffin made one of the most bad ass characters a trans woman?,3,Neutral,2
1888,When did everyone become so lesbian? Did I miss something?,4,Negative,3
3090,Are you a good little cum guzzler or are you a fucking wasteful slut that likes to play with their food?,4,Negative,3
5425,If you follow me ur gey,4,Negative,3
2140,"There is a millennial couple I know. Why do they look so asexual ? 

They fight about you father is chutiya and your mother is a bitch. 

Why aren’t millennials crazy about sex?",5,Very_Negative,4
1358,YCHS - where a queer named Neil Nijjar goes. nuff said,4,Negative,3
4657,Some are cancelling child sponsorships because World Vision will hire LGBT staff. Surely this is the height of cowardice.,2,Positive,1
5770,The new Queer Eye on  is amazing and everyone should watch it because it's so good and pure and every episode makes me weep.,2,Positive,1
4839,One of the early signs I should've seen that I'm bisexual was that I was in love with BOTH Beastboy and Raven.,2,Positive,1
3929,idk why it’s so hard for y’all to not hate trans women lol like baby YOU ARE THE PROBLEM! you the reason why trans women are dying on the street and are ostracized. because of the jokes Y’ALL crack and the memes YOU make. it’s tired and disgusting!,3,Neutral,2
2831,When lists of queer identities cite 'ally' ahead of 'asexual'. —.—,3,Neutral,2
1172,"Me: I'm bicurious, maybe..?

Me: *Sees hot nipple piercing pics.*

Me: I'm bisexual.",2,Positive,1
3268,Please don't joke that the A in LGBTQIA is for ally. Please don't joke that allies can earn it's inclusion. Asexuals need that.,2,Positive,1
2459,me and tranny need one for the 3v3 I'm not gonna try and he's gonna have an emotional break down Lmk,4,Negative,3
1464,I'll make sure to do a post or video about intersex for  because it's important,2,Positive,1
569,My days of being a Gay Ass Slut are over :sleepy face::sleepy face::sleepy face: but I will always be one at heart :sparkling heart::loudly crying face:,3,Neutral,2
364,i keep thinking i actually have a chance with lauren since she is bisexual but i obv dont have a chance with her cuz she is LAUREN JAUREGUI,3,Neutral,2
4008,godd do bigots tire of being bigots?? we get it!! you hate LGBT+ people! you hate Muslims! you hate women you hate poor people!! we get it!!,3,Neutral,2
3933,"""This is my lesbian girlfriend Lori, she's also my motherL",3,Neutral,2
5037,The one night I leave my student house there is a lesbian party 2 doors down. What have I done to deserve this bad luck?,3,Neutral,2
1399,all men are cocksuckers. no two ways about it. please don’t speak to me,4,Negative,3
6013,wait lmfao King James was a bisexual warlock? in 1563??????,3,Neutral,2
3772,"I will never forget the time I was co-teaching a sex ed class and someone asked about intersex people and my co-instructor said something like, ""Some people are born male, some people are born female, and sometimes God makes a mistake.""

(That last part is verbatim.)",3,Neutral,2
335,"All contact with potential participants will be kept confidential. #LGBT #queer #research #questioning 
7/7",3,Neutral,2
640,"'yes, it's just so amazing to be here in London for the Baftas'
[trans. 'some f**ker put this into my contract']",3,Neutral,2
1428,Glad the lack of medical support was highlighted in Wales for our Trans community #SweetSixteen  Time we had change #transhealth,2,Positive,1
4220,Every girl is just a little bit Lesbian,3,Neutral,2
3735,"Hey other LGBT ppl maybe dont toss around slurs whether or not they apply to u

some of us are still super hurt by that shit &amp;ur not helping",2,Positive,1
5871,It's official: changes to birth certificates for trans and intersex Victorians have passed the lower house! #springst,2,Positive,1
3749,"#LGBT #LESBIAN #GAY #BISEXUAL #TRANSGENDER “It’s okay. It may not seem like it right now, but u r going 2 b  fine. I know it’s scary, but don’t b afraid.U R who U R, U should love that person,  I don’t want anyone 2 have 2 go  through 22 years of their life afraid 2 accept that.”",1,Very_Positive,0
1444,trans people are everywhere bitch!! truly!,4,Negative,3
1435,"""I don't want a 2nd class bitch, I'm waiting for a perfect girl.""
You lesbian? Because the way you're acting makes you look like a pussy.",4,Negative,3
3091,"Pretty freaking amazing how ""pansexual"" went from ""OMG the word is in a YA!"" to ""Wow, the word is in *every* queer YA"" in the span of 2 yrs.",3,Neutral,2
761,about to be a hard ass lesbian,3,Neutral,2
2176,"All at the  wishing LGBTQ+ people a #HappyPride, as we discuss queer history with Prof. Simon Goldhill .",2,Positive,1
1701,apparently the short way of saying transmission is tranny &amp; at first i thought it was a transphobic slur but turns out it’s a real term lmfao,2,Positive,1
3511,Everyone talking about 'big dick energy' lately and my asexual ass is hiding in a corner,3,Neutral,2
1486,Some bitch and a bull dyke tried to get me fired today but didn’t work. Imma bout to start my gender transition into a female just to beat bitches asses legally.,3,Neutral,2
3030,It is legal to discriminate against someone for being transgender in 34 out of the 50 states.... What the hell,2,Positive,1
22,"""Avery is a lesbian Keebler Elf"" ~My Male Birther",3,Neutral,2
5574,Not amused that  says he wants to hear from trans people but is actually afraid to meet with any of us #TransBillMA,3,Neutral,2
2907,I'd rather be asexual than homosexual to be completely honest,4,Negative,3
3894,IF YOU'RE CALLING HARRY OR LOUIS' DANCE MOVES GAY YOU NEED TO FUCKING DELETE YOURSELF YOURE SO HARMFUL TO THE LGBT COMMUNITY FUCK YOU,2,Positive,1
4207,“ryou isn’t gay bc he’s intersex” is to say “I think who you are is determined by the body you have” so yikes.,3,Neutral,2
632,Absolutely loving  and  standing up for lesbian youth at #AucklandPride!,2,Positive,1
1930,"Robotnik is a feminist, tribbles are bisexual, and all of the world's animals are a certain percentage of cat or dog",3,Neutral,2
4753,The black church would be a voiceless anthill in the middle of nowhere if not for the sheer brilliance of black queer people. #AndThatsTea,2,Positive,1
4275,"lol I have a lesbian friend on snap and whenever she posts romantic posts with her gf, I respond ""you gay ??""",3,Neutral,2
4337,Can you believe the Netherlands is the most LGBT-friendly country in the world,2,Positive,1
5978,I cannot believe how much I love gay people,2,Positive,1
5590,** *** is transphobic i was deadass fighting him and he thinks im transgender lmao,3,Neutral,2
1366,"""Megan i'm a lesbian i'm not afraid of getting up, close and personal"" ",2,Positive,1
5262,I am at such a very iffy point in my life and it's scary and gay and I don't like it,3,Neutral,2
2569,Soft lesbian acoustics are such a perfect fall mood,2,Positive,1
2832,#Epilepsy Lesbian Gay Bisexual  Transsexual #LGBT If you are LGBT you are freely accepted in today’s society Mention that word #Seizure and the vast majority of people will NOT understand and will stay away  #Inequality,3,Neutral,2
4150,LGBTTTQQIAA 는 Lesbian Gay Bisexual Transgender Transsexual Two-spirited Queer Questioning Intersex Asexual Ally 의 약자입니다.,3,Neutral,2
864,"I'm a trans man and I say ""bitch"" with my homegirls. Thats gay culture. Ballroom culture. Whatever. Thats not what homeboy talmbout tho",2,Positive,1
4762,"My feminist politics usually turn women off. For them, it usually means I'm gay or asexual. #binarylogic",3,Neutral,2
3539,"#ThingsIFindOddlyHot Duh-doy!! Fucking possums! Cute, butch, punk, tall, short, shortstack, big tiddy, small tiddy, bottom heavy, top heavy, american, australian, male, female, nonbinary, intersex, trans!~ Gimme any kinda possum and I'll be a flustered, blushing mess for them~ :purple heart:",2,Positive,1
2173,"""haunted by his bisexual wife"" makes it sound like bi ppl are capable of transcending their corporeal form + haunting while still alive",3,Neutral,2
1179,trans people work so much harder than anyone knows to just fucking stay ALIVE so give money to one today and also every day,2,Positive,1
302,"TRAs: how dare you call someone transexual! That's a hateful slur you bigot!
Also TRAs: *conveniently turn a blind eye to male “allies” who have used the tra*** slur and made dehumanising jokes about trans people as long as they bully women for them*",3,Neutral,2
2923,I have big lesbian crush on madelaine petsch,3,Neutral,2
1302,hi i'm adel and i'm super gay for tom hardy,2,Positive,1
3899,"i’m crying in a bookstore rn because they have whole sections about the african diaspora and a trans/intersex, and queer section it’s so fucking amazing",1,Very_Positive,0
3344,STOP!! WRITING BI PEOPLE AS PEOPLE WHO JUST REALLY LOVE SEX AND WANNA HAVE SEX WITH /EVERYONE/,2,Positive,1
3145,"the Storks movie was too cute. they delivered to the disabled, gay and lesbian couples, single moms.. :loudly crying face:",2,Positive,1
4154,cheryl blossom being bisexual? a movement i can get behind because her actress isn't a dumb bitch,3,Neutral,2
4687,“Lesbian sex ain’t even sex!” THEN WHY ARE YOU CALLING IT SEX?!?! That’s like saying oral sex isn’t sex. The word “sex” is in the name!!!,3,Neutral,2
5102,u will pry bisexual Steve Rogers away from my cold dead hands,3,Neutral,2
2782,Who horny dm me :winking face: #horny #sex #porn #pornhub #nude #sexting #bi #milfs #shemale #dmme #girls #gay #TSgirls #straight #teen #cock #dick,3,Neutral,2
5170,"im a lesbian i deserve to watch the new tomb raider &amp; see alicia's Muscles:trade mark: on the big screen, it's my birthright,,,,,,, @ my local cinema wyd",3,Neutral,2
6097,So today I learned that Michelle Obama is a tranny,5,Very_Negative,4
5890,2013 may or may not be the year I quit dressin like a lesbian,3,Neutral,2
5292,Sat next to a transvestite who immediately ordered a vodka lemonade. Interesting 5 hours.,3,Neutral,2
2924,"Now that my ex wife is a lesbian she wants to be buddies, FUCK THAT !",3,Neutral,2
5075,"my boyfriend: i almost told my friends you're bi when i got high
me: why did you want to tell them tho?
him: because it's so interesting! you're the first bisexual person i know, that's hella rare!
him: and i wanna shove it in their faces that i can talk about girls with you",2,Positive,1
5686,I think Raven from Teen Titans was my bisexual awakening,2,Positive,1
309,"Christians will literally refer to God, a genital-lacking entity, as “He,” but refuse to refer to a trans woman as “she” .............",2,Positive,1
38,"I would dress up for #Halloween tonight, but as Britain's leading censorious student transsexual I think I'm scary enough :face screaming in fear::smiling face with horns:",3,Neutral,2
3652,When is Harry styles gonna come out as queer,2,Positive,1
3786,Dammit I'm still gay ugh,3,Neutral,2
3940,If you expect different from a trans woman than a cis woman go think on that.,2,Positive,1
4660,"The state of that “gaggle of gays” fawning over devil woman.

More like a flock of fuckwits.",4,Negative,3
2381,My kitty spent the whole night outside frolicking with the neighbour's dog. I may be loose but I just can't deal with inter-species sex.,3,Neutral,2
6034,Thanks for tellin me how ya all felt about my brain power write right class:unamused face: #cocksuckers,4,Negative,3
3872,I will never argue wit a girl on a social media that shit make yah niggas look gay.,5,Very_Negative,4
285,Help I'm drowning in attractive queer people #DykeMarch,2,Positive,1
5877,I must be asexual cause these niggas can’t FUCK wit me:face with steam from nose::hundred points::OK hand: medium-dark skin tone:,3,Neutral,2
104,Davis gay af freshman year as I was getting a tour at mo hi I saw a girl getting her shit tossed with brass knuckles in the girls locker,3,Neutral,2
6202,Why aren't I a lesbian? I could treat a girl so good,3,Neutral,2
3386,"I rly thought I was a lucky asexual with NO 地雷 on all abt BL n Otome things, from original to doujin, from general to rated, no matter how nasty/smexy/disgusting/sick it is. Okay I’m listening.",3,Neutral,2
4127,"J.P. thinks we give trans surgery to minors.

The only thing we do anything remotely like that is procedures on intersex infants with ambiguous genitalia, which are very bad, actually, and I'd hope most other trans people would be against too.",2,Positive,1
2675,Today's mood is: sick of being lumped together with homophobes purely because I identify as asexual.,3,Neutral,2
1641,when you're a hoe but you're asexual but you're still a hoe,2,Positive,1
2652,I think I may be asexual,3,Neutral,2
2009,What’s up with people and comparing EVERY GODDAMN MOVIE that features one or multiple LGBTQ+ characters,4,Negative,3
4306,Am i really considering watching Riverfail and having to suffer watching Cold Sprouts' terrible acting just so that I can see a lesbian couple thrive ???,2,Positive,1
2710,if your girlfriend or wife does not have a cock she aint worth jack. Tits and cock every time choose happiness choose a transsexual,4,Negative,3
5693,One of my cousins went to rehab after stealing a lot of shit from my family and another cousin came out as intersex. Been a hell of a day.,3,Neutral,2
2676,"watch midnight, texas tonight!! it's diverse, full of unique female chars, has a gay interracial couple, &amp; is awesome! please rt! (NBC @ 10)",2,Positive,1
406,I'm asexual now fuck errbody lol :person gesturing OK: medium-dark skin tone:,3,Neutral,2
6030,"Making my way downtown
Walkin fast
Faces pass
And I'm bisexual 

#NationalComingOutDay",2,Positive,1
3754,i'm queer and sad ***NOT CLICKBAIT!!!!!***,3,Neutral,2
460,"Lesbian version of ""fuck, marry, kill"": scissor, paper, stone.",3,Neutral,2
825,chik fil a is trash theyre anti-lgbt and for bluelivesmatter please dont support them/get their food,3,Neutral,2
4664,"this girl just called rob dyrdek hot.
im just going to become asexual.",4,Negative,3
3972,God I swear these boys cause more damn drama than girls. Fuck you all. I'm becoming asexual.,3,Neutral,2
3791,Why can't I just be asexual and not have feelings?,3,Neutral,2
4786,"this years pride is about working class and poor queers, queer poc, trans and intersex queers and queer woc. sorry rich white cis gays but it's time to get down on your hands and knees and give your comrades a step fucking up",1,Very_Positive,0
1562,i need to come out to my mom this weekend bc i wanna be open for asexual awareness week but i’m so stressed about doing it idk howwww ://:/ shdufbdb,2,Positive,1
1200,I am literally in a group chat with 5/5 and a bunch of horny lesbians who are sending photos of tits and pussys,3,Neutral,2
3207,"book idea: ""shit people ask lgbtqia people"" including informative anwsers such as ""yes i am literally attracted to pans"" and many more",3,Neutral,2
2433,Ur local queer kid always ready and willing to help if ur questioning ur identity,2,Positive,1
708,Happy Queer Christmas Eve everyone! :rainbow: ,2,Positive,1
4537,"there is so much to discuss/unpack surrounding the situation in Orlando but my heart goes out to queer folx everywhere, we can't be silenced",1,Very_Positive,0
5595,my asexual son has brought shame upon our Sex House,4,Negative,3
5720,I've been thirsty for beer since 5:30 pm; I'm the bisexual in your local Quaker Steak &amp; Lube chugging her Yuengling,3,Neutral,2
1608,The bisexual chick is bragging about her teet prowess. I love this show. #thebachelor,2,Positive,1
1619,"Getting the facts right about the 3rd marker, call out to religious leaders, policy makers, citizens help another in dimistfying the myths and misconceptions associated with Intersex persons and understand that it's bot a curse but a biological process. #IntersexCensusKE",2,Positive,1
3314,"I'm #asexual, so it's only natural that I don't give a fuck",2,Positive,1
942,"An inventive intersex Firbolg researcher, who vows to become an entertainer, seeks out canines, &amp; plants a seed whenever they kill something. 
 #dnd #dungeonsanddragons #npc",3,Neutral,2
4177,Here's a challenge: Find a LGBT+ person I DON'T love &amp; support w/ all my heart.,1,Very_Positive,0
3384,"So, other than being attacked on my personal for being ""racist"" I came out as asexual/aromantic to my dad today.",2,Positive,1
3700,". No more religious exemptions! #LGBTQ employees deserve protections, regardless of where they work. #ENDAEO #DearPOTUS",2,Positive,1
6131,Doing crafts and watching #goldengirls  like an 80 year old queer,3,Neutral,2
5535,Only negative about  :  no sexy sleep clothes. Asexual pajamas and robes stolen from hobos.,3,Neutral,2
3563,"I have no problem with punching low. I do have a problem with punching low and using vulnerable populations as the joke.Stop sharing cartoons or jokes about how Putin and Trump are in a gay relationship. The people harmed aren't Trump, Putin, or their followers. LGBTQ+ are harmed",2,Positive,1
3160,I been knew Justin Bieber was bisexual,3,Neutral,2
1707,"Me: I'm gay!! And asexual!!
Also me: So John Barrowman's dicc though :tongue::tongue::sweat droplets:",2,Positive,1
3096,"#IfJamaicansWereInTheBible

God: Abraham go to Sodom and Gom...
Abraham: yuh mad??? A baay battyman ova deso!!! Boom bye Bye!!!",4,Negative,3
4421,"When companies pander to me because I'm gay, it's like they're saying ""You're more to us than just dollar signs. You're also a cocksucker.""",3,Neutral,2
206,plot twist: I'm really a lesbian:women holding hands:,2,Positive,1
3049,"((""We can talk about cute boys!""
bullshit weiss we know you're a useless lesbian))",4,Negative,3
2101,stop using “gay” or “lesbian” as an insult. wake the fuck up.,1,Very_Positive,0
5876,"""I finally figured out my roommate, and I found out she's some lesbian from Colorado.""",3,Neutral,2
5674,someone on my feed rly just implied the unicorn ep wasn't a shitty trans metaphor and I just. hmmmm.,3,Neutral,2
1777,Is there an american holiday queer folks hate more than thanksgiving?,3,Neutral,2
3051,"Ok, asshole discussion of trans people. Time to leave the party before something happens",5,Very_Negative,4
3486,Lol nigga be acting like I'm gay shit wtf,3,Neutral,2
680,My sister thinks I’m mad cause she’s a lesbian... no it’s just your attitude. Just cause you’re a dyke doesn’t mean you HAVE TO BE A BITCH,3,Neutral,2
113,My brother just told me I’m a “Magneto bisexual”,3,Neutral,2
2432,"BTW, I'm celebrating being recognized today - got followed by . :)
Baty, gotta say it: for the amount of times I defended the game and explained in depth what's going on with it (not just banning people right away!), I should be on BI's payroll already! :)))",3,Neutral,2
4096,I wish I didn't sound like an asshole when I'm like um don't use the word retarded or gay in a vulgar context but you fucking shouldn't,3,Neutral,2
3354,"There should be no ""debate"" on gay marriage anymore. We live in a free state that should allow people the freedom to marry who they want",1,Very_Positive,0
911,all these headlines about phelps' girlfriend being 'born a man' when the articles say she was intersex???? this kind of erasure is FOUL,3,Neutral,2
1749,"America - where you can't serve in the military if you're transsexual, but you can be an accused child molester and still be in Congress.",2,Positive,1
4456,"Who started eating cat first, lesbians or Chinese? hahahaha",3,Neutral,2
219,"Well, Ryan's a girl now so looks like I am a lesbian",3,Neutral,2
6206,"Log Cabin Republicans: The GOP has drafted an extremely anti-LGBT platform!  How dare they!
Everyone else:  NO SHIT, SHERLOCK.",3,Neutral,2
2018,#INeedSocialJustice because there is literally no movie that wouldn't be improved by a gay gender queer black otherkin heroine.,3,Neutral,2
5331,I’m gay because in 9th grade I sang “almost drowned in the pussy so I swam to the butt” every time The Motto played. Thanks Drake smh,3,Neutral,2
1436,"someone: wants lgbt people to be seen as regular fucking people
same someone: IM GAY!!!! EVERYTHING IS GAY!!! EVERYTHING IS GAY CULTURE!!!!",3,Neutral,2
2825,Excited to be celebrating #SydneyMardiGras; a really important time for the gay lesbian bisexual transgender intersex and drug community.,3,Neutral,2
5699,"Statistically speaking, there are more intersex people in the world than there are Nazarenes. #ga2017",3,Neutral,2
5795,"On top of my depression, severe anxiety and eating disorder, I was diagnosed with bipolar. Also I'm queer, ace &amp; agender. Life is great. :))",2,Positive,1
908,You ever in a spot were you still like to laugh at relatable gay stuff but it turns out that your actually most likely trans after thinking you were gay for like 4 years or is that just a me thing,2,Positive,1
4532,"Can we just have a moratorium on cis people writing fiction with trans main/major characters for a couple years, please?",3,Neutral,2
5627,I don't care if she been waiting 3 hours ain't no dyke getting a haircut before me,4,Negative,3
3109,"Accidentally selected ""transgender"" on a job application and sent it off without realising, awkward",3,Neutral,2
2862,"LOL REMEMBER THAT GUY KEPT ON TRYING TO HIT ON U SO U TOLD HIM UR A LESBIAN AND HE KEPT GOING U WERE LIKE ""NO IM PRETTY SURE I LIKE VAGINA""",2,Positive,1
3631,"I get identified as a gay man by pretty much every stranger and the thing for me to balance is the ""no, I'm not, at all, either a man or attracted to them"" with the fact that I stand by gay men in our LGBT+ struggle and I'm proud of them too",1,Very_Positive,0
5099,I'm so disappointed in the Trans and gay community. So nasty &amp; so rude.,3,Neutral,2
2029,What’s good :winking face with tongue: u candy cane cum guzzler :tongue::Christmas tree:DICKCEMBER:Christmas tree: is here and u know what that means :snowflake: HOE HOE HOE season has arrived :Santa Claus:,5,Very_Negative,4
5848,karma is a bitch and a lesbian,3,Neutral,2
5601,Sometimes my Goodwill Outlet sells books by the gaylord (big shipping box on a pallet--like a watermelon bin).  They are usually full of mostly Harlequins from the 90s.  If I had a van I'd buy one just to say I bought a gaylord of romance novels.,4,Negative,3
2759,"boycott e621 
apparently you can get banned for tagging ""intersex"" and not tagging the other terf words with it too.
load of bullshit.",4,Negative,3
